{
  "id": "LASSMT-CJEU-C467-25P",
  "case_ref": "LCASE-CJEU-DA-PHARMA-C467-25P",
  "evaluated_conduct": "The appellate procedural disposition in D&A Pharma v EMA concerning interest in bringing proceedings and the limits of appellate review.",
  "applicability_refs": [
    "APPL-CJEU-C467-25P-APPEAL"
  ],
  "claim_refs": [
    "LCLAIM-CJEU-C467-25P-APPEAL-DISMISSED"
  ],
  "legal_result": "UNRESOLVED",
  "reasoning": [
    {
      "statement": "The EU appellate procedural framework applies to the Court of Justice appeal and the Court dismissed the appeal in full.",
      "basis_refs": [
        "APPL-CJEU-C467-25P-APPEAL",
        "HOLD-CJEU-C467-25P-APPEAL-DISMISSED"
      ]
    },
    {
      "statement": "A procedural dismissal does not itself determine the scientific merits of the medicinal product or transform the underlying CHMP opinion into a broader substantive legal result.",
      "basis_refs": [
        "AUTH-CJEU-C467-25P-JUDGMENT-2026-09-10"
      ]
    }
  ],
  "contrary_authority_refs": [],
  "unresolved_questions": [
    "Any separate proposition about the underlying CHMP scientific assessment or EMA administrative merits requires its own source-bounded analysis."
  ],
  "confidence": 0.98,
  "mizan": {
    "status": "NOT_RUN",
    "principle_refs": [],
    "explanation": "No Mizan result is generated from an appellate procedural dismissal."
  },
  "review": {
    "status": "APPROVED",
    "reviewer_ref": "owner-delegated-chatgpt-review",
    "reviewed_at": "2026-10-04T13:35:00Z",
    "notes": "Explicit promotion review performed under the repository owner's instruction to execute backlog closure. Exact main dedup was clean immediately before promotion; the review preserves the narrow appellate-procedure scope and excludes medicinal-product scientific merits."
  },
  "source_revision_refs": [],
  "generated_at": "2026-10-04T13:30:00Z"
}
